{
  "$schema": "https://gcn.nasa.gov/schema/gcn/notices/icecube/GoldAndBronze.schema.json",
  "type": "IceCube Bronze Neutrino Track Alert",
  "event": {
    "event_name": ["IceCube-230416A"],
    "id": ["137840", "57034692"]
  },
  "localization": {
    "ra": 345.82,
    "dec": 9.01,
    "uncertainty_shape": "rectangle",
    "position_angle": 0,
    "semi_major": [-1.5, 1.4],
    "semi_minor": [-1.2, 1.3],
    "containment_probability": 0.9,
    "systematic_included": false,
    "healpix_url": "https://roc.icecube.wisc.edu/public/"
  },
  "discovery_datetime": {
    "trigger_time": "2023-04-16T05:22:26.150574"
  },
  "revision": 1,
  "energy": 127.29,
  "signalness": 0.34064,
  "far": {
    "far": 8.029e-8
  }
}
